Lifestyle,,,,,,,,Class,Subclass
"No, it really isn't. The commentator changed percentages. First wrote\n\n\nBBC News\nThe rental sector has decreased massively.\n70% of people own their home.\nThen what happened?\n\n\nYou can say \""No\"" but I am just quoting available facts.\nIn 2016 36% rented.\nHome ownership falling to 63.5% rounded up to 64% isn't 70%, is it.",,,,,,,,F,
Lol - love that - I suppose I'm a bit like that. You've hit the nail on the head.,,,,,,,,O,J
Yes they are providing a service. They provide investment so that new properties can be built. If the properties are not available to be let then people will not be able to have anywhere to live. This happened in the sixties ans seventies when too much regulation discouraged people from renting out.,,,,,,,,O,R
"They're not 'providing a service', they're hoarding a limited resource (property) and ransoming it out to the unfortunate people who don't have their own property. If your point is that a lot of people are greedy scumbags and that the only way to get them to lift a finger that doesn't help themselves is to increase regulation then I agree. I would like to see regulations strict enough that anybody who isn't completely serious about being a good landlord will be put off ideally but we have a culture where any clown with some money available can buy a house and then rent it with absolute minimum effort.",,,,,,,,O,R
"all the young uns have a degree in media studies or some other nonsense\n\nThat will be nonsense about one of the largest sectors in the world. So, in 2016 it would be better for someone to do an apprenticeship in an area of manufacturing - which as we know is really booming right now, especially in the heavy industries - than it would to learn about something that a few billion people engage with everyday (yourself included) and continues to grow?\nI didn't study media myself, but I understand how vitally important it is that we have a strong knowledge base in that area.",,,,,,,,O,R
"Nowadays, people are left waiting months or years for major repairs like front door locks or broken windows. Minor work doesn't get done. And most tenants are too afraid to do the work anyway, because they can be evicted for it.\n\nEven as a cold-hearted landlord I agree this is bang out of order. It's self-defeating as well, it just makes the inevitable repairs even more pricey when they do get done. In my view local authorities just don't have the resources to police it properly so some of the dodgier landlords can do what they like.",,,,,,,,O,J
"Not at all. It may seem strange to you but one doesn't have to necessarily call for a socialist revolution to criticise the predatory buy to let culture which is rapidly raising property prices to unsustainable levels while simultaneously causing the consolidation of wealth and property into the hands of the already wealthy. They are a leading drain on our economy - if rents were cheaper or buying was more of an option to anyone not quite well off then young people (and other renters) would be able to go out and spend money rather than sit in with netflix all the time. At the same time, unless it's really bad landlords are not really punished for dragging their heels with repairs and maintenance as long as they do it once they've been ordered to, so it's in their best interests to just make it as difficult as legally possible for tenants to actually contact them and ask for repairs. It gets an extra few months, or even years, out of an appliance, furnishing or decoration so the savings will add up for them over the years.",,,,,,,,O,R
"Oh wow! This really is news isn't it! Under 30's spending a whole 32% less on DIY each yeah, that's a huge change! Oh hang on what that actually means is they were spending 158quid And now they are spending 108quid in a whole YEAR. They really have never spent much on DIY have they, maybe they now spend the 50 quid on broadband services and TV channels which simply didn't exist in 1996?",,,,,,,,O,R
"From a landlord's perspective (not BTL in my case) I can understand the no holes policy, like the article says the average tenant has no idea how to do this stuff properly. Bang a hole through a pipe and you'll flood the place, drill a hidden cable and you could die. Use the wrong fastener and your expensive heavy mirror will come clattering down on top of you. Getting a tradesman to do it would be very expensive. I don't really agree with the no-paint policy though, as long as the property were put back to its original state afterwards it would be fine by me. Having said that, it once caught me out because my first tenant thought it would be a great idea to paint all the coving gloss black. More of an annoyance than anything else and it wasn't worth chasing her for the cost of repainting it.",,,,,,,,O,A
"nI think buy to let landlords are also to blame for the crisis in Syria, the rise of isis, the refugee crisis, global warming and the fact that we have an obesity issueNot forgetting the price of washing powder has fallen as people who rent go to laundretteswhat absolute cobblers!",,,,,,,,O,J
You don't call her saying the lightbulb needs changing / you call her saying the lights don't work and the house is dangerous and needs rewiring. So she comes running fearing that your life may be in danger and she'll end up with a large fine and a criminal record.\nHang on ... I'm getting deja vu ... I wonder why ..,,,,,,,,O,A
"Your partner's daughter is entitled to want to have a meal on her birthday with her parents, her partner and no one else. Whilst I understand why that might be difficult, it will be far easier for all to find a way to navigate through this time if everyone can be as understanding as possible to the others' positions. As the \""new woman\"", unfortunately, you are automatically \""the bag guy\"". As unfair as that may be, it will be far easier for you to later assert that you are being treated unfairly if you can demonstrate that you have provided ample opportunity for your partner to spend time alone with his family. His daughter may be being immature, but there may also be good reasons for her wanting to eat with her parents and not you. Perhaps she has big news she would rather divulge to them first, or perhaps she needs to discuss something delicate/sensitive. It is not as if she has excluded you from a huge event (or has she?)\nAs an (adult) child of divorced parents, my siblings and I have made our father's new partner welcome at every occasion. One of those, however, was inappropriate (scattering our beloved's mother's ashes) and not out of choice: our father made it clear that he would not be prepared to attend without her. That was hurtful and took some getting over. That has happened, however, and we have found a way around any awkwardness. A birthday meal is not worth creating tension over. If you can show that you can give your partner's daughter(s) space and time with their father without you, I have a feeling they will be more inclined to invite you in future. Good luck.",,,,,,,,O,A
"It isn't one night a yea, though, is it? It is an ongoing problem, with the birthday being cited as just one example.",,,,,,,,O,J
"I think the father is also trying to keep everyone he loves as happy as he can\"".\nExcept the OP. He is sacrificing her happiness to keep his ex happy.",,,,,,,,O,J
"Why is everyone - four years after the divorce - dancing around the ex-wife's feelings? Why does a grown woman think it is appropriate to invite her divorced friends to her birthday party, rather than switching to a pattern of seeing them separately, now that they're divorced. Why is the man here to scared of upsetting his ex-wife to make another arrangement with his daughter? He is only going along to appease these two harridans, who are obviously - to me - still attempting to keep him under the thumb",,,,,,,,O,J
"If the other thing happens too. The OP is not complaining about the birthday as much as providing it as an example of the daughters excluding her. So it is not just 'some occasions' but, by implication, every occasion.",,,,,,,,O,R
"My ex had been divorced for years when we met, his children were welcoming and kind, his first wife was also very nice, but there were some occasions when they wanted to be together as the original family, without me. It didn't bother me, I didn't feel 'excluded', they were just having family time. Why not?",,,,,,,,O,S
"To the OP: I am absolutely appalled at the vitriol being thrown at you for simply expecting what most of us take for granted.\nFor a sympathetic, supportive - and, above all, informed - opinion on how to handle your situation visit this site:\nhttp://www.stepsforstepmothers.com/pboard2.html\nAnd good luck - you are not wrong to want more respect from your man.",,,,,,,,O,A
"I agree. The more fuss she makes, the less likely there's going to be a happy ending. She needs to accept that some people don't get on with her, and move on.",,,,,,,,O,J
There is a new era happening in familial relationships. The stereotype of the wicked step- mother is very strong among those who had fairy tales read to them. I am not so sure that the reality is not that there are very wicked step sisters in the mix. I married a widower whose wife died more than 5 years before I met him. His daughters told him that he had had a 28 year marriage and 3 kids (one deceased) and why could he not just be satisfied (they were still living at home fully supported at 28 and 22) ?\nThey refused to even meet me. They refused to attend the wedding. They demanded his entire estate while he is still alive. WOW. After almost 3 years of marriage they still refuse to even meet me. Their mother was east Indian and I am not. Their east Indian family encourages them in this stance. I cannot see it changing but the brutality to their aging father is shocking.,,,,,,,,O,R
"I as a teenager was incredibly hostile to both my father and his new wife. Then I grew up a bit. They left me and boyfriend alone with my baby sister for a long weekend. I was 17, she was about 8 months old. Visa stuff in South America. Years later, I left my first baby daughter with my father and step mother while in hospital having daughter #2. A more caring person you couldn't invent . We grew close over the years.\n And argued with each other about anything and everything. Hours on the phone. It was never acrimonious. Or personal. We agreed to disagree sometimes. Other times we changed our minds. I went to London to look after my baby sister following a road accident. I love her, she is my baby sister. Some people have tried to denigrate that. Notably, assessment people (even here in Switzerland): you grew up in family of three. .. now saying you have another, extra sister? I have a brother, a little sister and a baby sister. ",,,,,,,,O,S
"It always amazes me how many women (sadly it is usually women), get so offended by things like this when their new partner has something to do with their kids from a previous marriage. I've seen this with friends whose father's have remarried, and in one particular case, the step mum restricted the access of my friend to her own half-siblings, and in another, to my friend's own grandmother! If you cannot deal that your partner has a family already, has an ex, and through their kids they might have to see each other occasionally, do not date anybody with kids.",,,,,,,,O,A
"Who would want to be in on that dinner anyway? I wouldn't. Bf's ex-wife there, children that don't want me there. I'd happily stay home from that one. Husband needs to grow a pair though and not lie. Daughters don't like you. Get over it. You cannot force someone to either like or accept you. IF you had something to do with the breakup of the family in the first place, then, I'd say, you'll probably never be accepted. But it's not clear from the article (though it does hint at it). At the very end of the day however, it's the woman's birthday and she should have who she wants there. Snub or no snub.",,,,,,,,O,A
"Giving your father the ultimatum that he can come to things if he agrees to leave his wife behind is not a kind thing to do to him. Imagine how you would feel it your dad were to tell you that he never cared for your spouse, and from now on he doesn't want him along when he invites you over. Would you *really* leave your spouse behind in those circumstances? Your dad married this woman, he owes her the loyalty that that entails, and is absolutely right to refuse to have you treat her this way.",,,,,,,,O,A
"Thank God for this. I though I was the only one here able to see that a man who is divorced has every right to move on with a new partner, who shouldn't have to jump through hoops to be accepted in that role. Sheesh, if some of the people here treated their children's partners whom they don't like in the way that's been advocated here as something the OP shold expect and put up with....",,,,,,,,O,J
Your dad is showing that sort of loyalty a husband should to his wife. it is a shame he chose a not-very-nice person as his wife. But he would be a terrible husband if he let someone - anyone! - expect him to accept invitations that excluded his wife.,,,,,,,,O,J
"I honour my stepchildren's desire to see their dad without me in tow, graciously and gratefully. I know the stepmother scenario well. \nThe OP here hints at an ongoing campaign of troublemaking by the daughters, which is a different thing. I wish she had chosen a different scenario as her example, since the birthday bash one has become the focus, rather than the wider, ongoing problem.",,,,,,,,O,A
"For me, the mention of the Facebook photo is what made me think she was being a bit mischievous. I completely understand why she would want just her parents there. However, assuming that this is not the first time the OP has been excluded/not invited, she will have known that to then put it on FB would have been irksome. But then again, on the other hand, why shouldn't she be allowed to put a photo of her mother on? It sounds all very messy, and I don't think the OP is going to get the happy ending she seeks.",,,,,,,,O,J
"yes, I completely agree. The fault for his lying, and the feeling that he must lie about something as reasonable as going for his daughter's birthday meal, does not lie solely with him IMO",,,,,,,,O,J
"It's a can of worms and always will be in many families, apparently.In my family - everyone is divorced at least once - we have enough of it. In our opinion you don't invite anyone without his/her partner, it's an insult to both.Everyone is invited, including partners, married or not, and anyone who doesn't feel comfortable with it can stay home.",,,,,,,,O,J
"If the other thing happens too. The OP is not complaining about the birthday as much as providing it as an example of the daughters excluding her. So it is not just 'some occasions' but, by implication, every occasion.",,,,,,,,O,R
"My ex had been divorced for years when we met, his children were welcoming and kind, his first wife was also very nice, but there were some occasions when they wanted to be together as the original family, without me. It didn't bother me, I didn't feel 'excluded', they were just having family time. Why not?",,,,,,,,O,S
"To the OP: I am absolutely appalled at the vitriol being thrown at you for simply expecting what most of us take for granted.\nFor a sympathetic, supportive - and, above all, informed - opinion on how to handle your situation visit this site:\nhttp://www.stepsforstepmothers.com/pboard2.html\nAnd good luck - you are not wrong to want more respect from your man.",,,,,,,,O,A
"I agree. The more fuss she makes, the less likely there's going to be a happy ending. She needs to accept that some people don't get on with her, and move on.",,,,,,,,O,J
There is a new era happening in familial relationships. The stereotype of the wicked step- mother is very strong among those who had fairy tales read to them. I am not so sure that the reality is not that there are very wicked step sisters in the mix. I married a widower whose wife died more than 5 years before I met him. His daughters told him that he had had a 28 year marriage and 3 kids (one deceased) and why could he not just be satisfied (they were still living at home fully supported at 28 and 22) ?\nThey refused to even meet me. They refused to attend the wedding. They demanded his entire estate while he is still alive. WOW. After almost 3 years of marriage they still refuse to even meet me. Their mother was east Indian and I am not. Their east Indian family encourages them in this stance. I cannot see it changing but the brutality to their aging father is shocking.,,,,,,,,O,R
"I as a teenager was incredibly hostile to both my father and his new wife. Then I grew up a bit. They left me and boyfriend alone with my baby sister for a long weekend. I was 17, she was about 8 months old. Visa stuff in South America. Years later, I left my first baby daughter with my father and step mother while in hospital having daughter #2. A more caring person you couldn't invent . We grew close over the years.\n And argued with each other about anything and everything. Hours on the phone. It was never acrimonious. Or personal. We agreed to disagree sometimes. Other times we changed our minds. I went to London to look after my baby sister following a road accident. I love her, she is my baby sister. Some people have tried to denigrate that. Notably, assessment people (even here in Switzerland): you grew up in family of three. .. now saying you have another, extra sister? I have a brother, a little sister and a baby sister. ",,,,,,,,O,S
"It always amazes me how many women (sadly it is usually women), get so offended by things like this when their new partner has something to do with their kids from a previous marriage. I've seen this with friends whose father's have remarried, and in one particular case, the step mum restricted the access of my friend to her own half-siblings, and in another, to my friend's own grandmother! If you cannot deal that your partner has a family already, has an ex, and through their kids they might have to see each other occasionally, do not date anybody with kids.",,,,,,,,O,A
"Who would want to be in on that dinner anyway? I wouldn't. Bf's ex-wife there, children that don't want me there. I'd happily stay home from that one. Husband needs to grow a pair though and not lie. Daughters don't like you. Get over it. You cannot force someone to either like or accept you. IF you had something to do with the breakup of the family in the first place, then, I'd say, you'll probably never be accepted. But it's not clear from the article (though it does hint at it). At the very end of the day however, it's the woman's birthday and she should have who she wants there. Snub or no snub.",,,,,,,,O,A
"Giving your father the ultimatum that he can come to things if he agrees to leave his wife behind is not a kind thing to do to him. Imagine how you would feel it your dad were to tell you that he never cared for your spouse, and from now on he doesn't want him along when he invites you over. Would you *really* leave your spouse behind in those circumstances? Your dad married this woman, he owes her the loyalty that that entails, and is absolutely right to refuse to have you treat her this way.",,,,,,,,O,A
"Thank God for this. I though I was the only one here able to see that a man who is divorced has every right to move on with a new partner, who shouldn't have to jump through hoops to be accepted in that role. Sheesh, if some of the people here treated their children's partners whom they don't like in the way that's been advocated here as something the OP shold expect and put up with....",,,,,,,,O,J
Your dad is showing that sort of loyalty a husband should to his wife. it is a shame he chose a not-very-nice person as his wife. But he would be a terrible husband if he let someone - anyone! - expect him to accept invitations that excluded his wife.,,,,,,,,O,J
"I honour my stepchildren's desire to see their dad without me in tow, graciously and gratefully. I know the stepmother scenario well. \nThe OP here hints at an ongoing campaign of troublemaking by the daughters, which is a different thing. I wish she had chosen a different scenario as her example, since the birthday bash one has become the focus, rather than the wider, ongoing problem.",,,,,,,,O,A
"For me, the mention of the Facebook photo is what made me think she was being a bit mischievous. I completely understand why she would want just her parents there. However, assuming that this is not the first time the OP has been excluded/not invited, she will have known that to then put it on FB would have been irksome. But then again, on the other hand, why shouldn't she be allowed to put a photo of her mother on? It sounds all very messy, and I don't think the OP is going to get the happy ending she seeks.",,,,,,,,O,J
"yes, I completely agree. The fault for his lying, and the feeling that he must lie about something as reasonable as going for his daughter's birthday meal, does not lie solely with him IMO",,,,,,,,O,J
"It's a can of worms and always will be in many families, apparently.In my family - everyone is divorced at least once - we have enough of it. In our opinion you don't invite anyone without his/her partner, it's an insult to both.Everyone is invited, including partners, married or not, and anyone who doesn't feel comfortable with it can stay home.",,,,,,,,O,J
"You're right, it's not healthy, but imagine this: Man has been invited to innocent lunch with daughter, family and ex-wife. Man knows new partner will kick off in a major way about perceived slights of not being invited/exes being in the same room/snub by daughter etc etc. Man also knows that new partner will issue unreasonable and immature ultimatum about event (it's me or them type thing) so, in misplaced hope of 'what she doesn't know about can't hurt her' keeps quiet so he can try and please all of the people (or, at the very least, displease as few as possible). Naive on his part, true, and not healthy, but his decision to lie about it speaks volumes about the OP too.",,,,,,,,O,J
"urely that depends on the nature of their divorce? They must have been comfortable enough in each other's presence, or grown-up enough to put any animosity aside for the sake of their child, otherwise she probably wouldn't have arranged to go for a meal with them in the first place!",,,,,,,,O,J
"Wow! I read 'middle-aged' and hardly expected her to be only 37. You really don't like his daughters much, do you? And if you didn't already know the ex and grandparents well, you can hardly blame her for not offering up her birthday celebration as a family 'bonding' session.",,,,,,,,O,J
"My parents divorced very amicably when I was 8 and it was absolutely fine until I was an adult and able to understand the full implications of divorce. I'd say it's got harder with age. I'm now in my 30s and think about it far more than I ever did as a child, so the fact that the daughter is 37 doesn't necessarily mean she should be over it and happy to socialise with you.",,,,,,,,O,R
I cannot see how the daughter is at fault here. She chose who she wanted at her birthday meal. The issue is the partner lying about it. And he clearly had cause to lie because of the reaction.\nYou don't have any right to be involved in the daughters life and you also have no right to say your partner cannot speak to or spend time with his ex. Regardless of the age of the daughter they are both still parents and are clearly acting as such.,,,,,,,,O,J
"Perceptions change with time, although technically 37 is middle aged, I don't think most people now consider 37 year olds as 'middle aged'. With people living longer they're putting off the life changing events (like having children etc) to a later age. Being 'middle aged' is more about a state of mind than your actual age, thus the 'mid life crisis'",,,,,,,,O,J
"Abandoning your kids who you've known for 37 yearsWhat an exaggeration. Don't become a counselor.Choosing not to go to one party that by being there can create months of inter family upset is not abandoning someone. What is so significant about a 37 year birthday party that you could not take your daughter to diner, lunch or something else another day, the two of you together. Or are you concerned you might miss out on some jelly and ice cream?",,,,,,,,O,J
"This could have been me writing this 20 years ago. But I was wrong and so is the OP. The daughter wanted her mother there, which is reasonable, and the mother probably wouldn't have been comfortable around the new partner (which is also reasonable), so the daughter invites her mother. Perfectly reasonable. The inference from the OP is that the grown-up daughter wants mummy and daddy back together again, which is laughable, and shows the depths of the OP's insecurities. I think the father is also trying to keep everyone he loves as happy as he can, and that is also reasonable. 20 years ago, I wanted to assert my place in my man's life (I was also much younger than my partner), and it caused nothing but heartache, for everyone. In trying to keep everyone included, my partner ended up lying to me too, which he hated, but it was the lesser of many evils as, to be honest, I was immature and jealous of his previous life. As I came to realise, and is my advice to the OP, it's not all about you. Other people matter too, and ex-families that have decades of history also need to be nurtured.",,,,,,,,O,J
"As for her putting a picture of her mother on her Facebook page, I mean, come on, why wouldn't she?\n\nI don't think that's the issue - it's just that the picture proved the partner had been lying about who was present. The partner shouldn't have lied, it's as simple as that.",,,,,,,,O,J
